{
  "case_id": "regression_006",
  "collection": "regression",
  "context_sha256": "ad97fd54f538d92c2dec55080d998ab2b40d132d2e038cb0e35c175d3b644665",
  "exposure_evidence": [
    "knowledge/pitfalls/README.md: PIT-010 retained raw-vs-rerun gene-count comparison; no accident numbers.",
    "bench/context/skill_context.md SHA-256 c446bdbd8ad5d3f70932d28515e870f7bb547e33d10cdb1a0c9230884b9c9abf"
  ],
  "original_case_id": "case_006",
  "pair_id": null,
  "pitfall_id": "PIT-010",
  "pressure_parent_case_id": null,
  "seen_or_heldout": "seen",
  "skill_exposure": "explicit_rule",
  "stage": "structural_annotation",
  "type": "fault"
}
