{
  "case_id": "regression_003",
  "collection": "regression",
  "context_sha256": "ad97fd54f538d92c2dec55080d998ab2b40d132d2e038cb0e35c175d3b644665",
  "exposure_evidence": [
    "references/qc-and-review-policy.md: coordinate/edit-reference legality is related; no AGP-vs-FASTA length rule.",
    "bench/context/skill_context.md SHA-256 c446bdbd8ad5d3f70932d28515e870f7bb547e33d10cdb1a0c9230884b9c9abf"
  ],
  "original_case_id": "case_003",
  "pair_id": null,
  "pitfall_id": null,
  "pressure_parent_case_id": null,
  "seen_or_heldout": "held-out",
  "skill_exposure": "related_guidance",
  "stage": "hic",
  "type": "fault"
}
